{"bundleId":"evidence-1","schemaVersion":"1.0","contentHash":"aaaaaaaaaaaaaaaaaaaaaaaaaaaaaaaaaaaaaaaaaaaaaaaaaaaaaaaaaaaaaaaa","status":"COMPLETE","operationId":"op-1","sourceRevision":"r1","fixtureModelHash":"bbbbbbbbbbbbbbbbbbbbbbbbbbbbbbbbbbbbbbbbbbbbbbbbbbbbbbbbbbbbbbbb","references":[{"artifactId":"ui-1","artifactType":"UI_DESIGN_SPEC_V2","schemaVersion":"2.0","contentHash":"cccccccccccccccccccccccccccccccccccccccccccccccccccccccccccccccc","sourceRevision":"r1"},{"artifactId":"spec-1","artifactType":"SCREEN_SPECIFICATION","schemaVersion":"1.0","contentHash":"dddddddddddddddddddddddddddddddddddddddddddddddddddddddddddddddd","sourceRevision":"r1"},{"artifactId":"renderer-1","artifactType":"RENDERER_PROFILE","schemaVersion":"1.0","contentHash":"eeeeeeeeeeeeeeeeeeeeeeeeeeeeeeeeeeeeeeeeeeeeeeeeeeeeeeeeeeeeeeee","sourceRevision":"r1"}],"artifacts":[],"reports":{"binding":{"artifactId":"binding-1","artifactType":"BINDING_REPORT","schemaVersion":"1.0","contentHash":"1111111111111111111111111111111111111111111111111111111111111111","sourceRevision":"r1"},"build":{"artifactId":"build-1","artifactType":"BUILD_REPORT","schemaVersion":"1.0","contentHash":"2222222222222222222222222222222222222222222222222222222222222222","sourceRevision":"r1"},"render":{"artifactId":"render-1","artifactType":"RENDER_REPORT","schemaVersion":"1.0","contentHash":"3333333333333333333333333333333333333333333333333333333333333333","sourceRevision":"r1"}},"fallbackAssessments":[],"warnings":[],"finalDecision":"PASS"}
